{
  "$schema": "https://json-schema.org/draft/2020-12/schema",
  "$id": "urn:ysefinance:aesm-manual-capture-request:0.1.0",
  "title": "AESM manual capture request",
  "type": "object",
  "properties": {
    "schema_version": {
      "type": "string",
      "const": "0.1.0"
    },
    "indicator": {
      "type": "string",
      "enum": [
        "E01",
        "E02",
        "E03",
        "E04",
        "E05",
        "E06",
        "E07",
        "E08",
        "E09",
        "E10",
        "E11",
        "E12",
        "S01",
        "S02",
        "S03",
        "S04",
        "S05",
        "S06",
        "S07",
        "S08"
      ]
    },
    "methodological_variant": {
      "anyOf": [
        {
          "type": "string",
          "minLength": 1
        },
        {
          "type": "null"
        }
      ]
    },
    "source_role": {
      "type": "string",
      "minLength": 1
    },
    "provider": {
      "type": "string",
      "enum": [
        "ABS",
        "RBA"
      ]
    },
    "official_source_url": {
      "type": "string",
      "pattern": "^https://"
    },
    "release": {
      "type": "object",
      "properties": {
        "date": {
          "anyOf": [
            {
              "type": "string",
              "pattern": "^\\d{4}-\\d{2}-\\d{2}$"
            },
            {
              "type": "null"
            }
          ]
        },
        "period": {
          "anyOf": [
            {
              "type": "string",
              "minLength": 1
            },
            {
              "type": "null"
            }
          ]
        },
        "evidence_url": {
          "anyOf": [
            {
              "type": "string",
              "pattern": "^https://"
            },
            {
              "type": "null"
            }
          ]
        },
        "verification_note": {
          "anyOf": [
            {
              "type": "string",
              "minLength": 1
            },
            {
              "type": "null"
            }
          ]
        }
      },
      "required": [
        "date",
        "period",
        "evidence_url",
        "verification_note"
      ],
      "additionalProperties": false
    },
    "validation_contract": {
      "type": "object",
      "properties": {
        "adapter": {
          "type": "string",
          "enum": [
            "ABS_XLSX",
            "RBA_CSV",
            "ABS_SDMX_CSV"
          ]
        },
        "series_id": {
          "type": "string",
          "minLength": 1
        },
        "description": {
          "type": "string",
          "minLength": 1
        },
        "unit": {
          "type": "string",
          "minLength": 1
        },
        "frequency": {
          "type": "string",
          "enum": [
            "quarterly",
            "monthly"
          ]
        },
        "seasonal_adjustment": {
          "anyOf": [
            {
              "type": "string",
              "minLength": 1
            },
            {
              "type": "null"
            }
          ]
        },
        "data_type": {
          "anyOf": [
            {
              "type": "string",
              "minLength": 1
            },
            {
              "type": "null"
            }
          ]
        },
        "table": {
          "anyOf": [
            {
              "type": "string",
              "minLength": 1
            },
            {
              "type": "null"
            }
          ]
        },
        "dimensions": {
          "type": "object",
          "additionalProperties": {
            "type": "string",
            "minLength": 1
          }
        },
        "minimum_observations": {
          "type": "integer",
          "minimum": 1
        }
      },
      "required": [
        "adapter",
        "series_id",
        "description",
        "unit",
        "frequency",
        "seasonal_adjustment",
        "data_type",
        "table",
        "dimensions",
        "minimum_observations"
      ],
      "additionalProperties": false
    },
    "maximum_bytes": {
      "type": "integer",
      "minimum": 1
    }
  },
  "required": [
    "schema_version",
    "indicator",
    "methodological_variant",
    "source_role",
    "provider",
    "official_source_url",
    "release",
    "validation_contract",
    "maximum_bytes"
  ],
  "additionalProperties": false
}
